{
  "kind": "execution_policy",
  "schema_version": "1.0.0",
  "policy_id": "exec_workspace_demo",
  "policy_version": "1.0.0",
  "tenant_id": "tenant_demo",
  "issuer": {
    "actor_id": "user_policy_01",
    "actor_type": "human",
    "role": "policy_owner"
  },
  "authority_ref": "contract_demo_msa_2026",
  "effective_from": "2026-10-01T00:00:00Z",
  "effective_until": "2027-01-01T00:00:00Z",
  "enforcement": {
    "method": "service_enforced",
    "evidence_ref": "evidence_exec_workspace_demo"
  },
  "locations": [
    {
      "location_id": "loc_workspace_demo",
      "location_type": "tenant_environment",
      "residency": [
        "US"
      ],
      "capabilities": [
        "sql_aggregate",
        "python_batch"
      ]
    }
  ],
  "operations": [
    {
      "operation": "intake_receive",
      "permission": "permitted",
      "conditions": []
    },
    {
      "operation": "profile",
      "permission": "permitted",
      "conditions": []
    },
    {
      "operation": "map_semantics",
      "permission": "permitted",
      "conditions": []
    },
    {
      "operation": "build_features",
      "permission": "permitted",
      "conditions": []
    },
    {
      "operation": "join",
      "permission": "permitted",
      "conditions": []
    },
    {
      "operation": "embed_content",
      "permission": "permitted",
      "conditions": []
    },
    {
      "operation": "train",
      "permission": "permitted",
      "conditions": []
    },
    {
      "operation": "validate",
      "permission": "permitted",
      "conditions": []
    },
    {
      "operation": "calibrate",
      "permission": "permitted",
      "conditions": []
    },
    {
      "operation": "infer",
      "permission": "permitted",
      "conditions": []
    },
    {
      "operation": "score",
      "permission": "permitted",
      "conditions": []
    },
    {
      "operation": "build_cohort",
      "permission": "permitted",
      "conditions": []
    },
    {
      "operation": "aggregate",
      "permission": "permitted",
      "conditions": []
    },
    {
      "operation": "prepare_release",
      "permission": "permitted",
      "conditions": []
    },
    {
      "operation": "export_rows",
      "permission": "permitted",
      "conditions": []
    }
  ]
}
